uid,title,link,source,published,summary
11b73ef9ccf4ccdba2202e3512f4c3b5,"Напиши им в поддержку, они может деньгами компенсируют.",https://t.me/nn4st/246214,t.me,2025-08-08T09:33:28+00:00,"<br />Напиши им в поддержку, они может деньгами компенсируют. Я так в insta360 , случайно нашла ошибку, написала им, мне денег вернули за покупку 😵‍💫😁"
841e5126cd07ab14dbebbee5cdfb5f7c,На компе.,https://t.me/nn4st/246213,t.me,2025-08-08T09:31:13+00:00,<br />На компе. Платная версия. Открывала-выходила-закрывала-сбрасывала. Глюк 😅😂
a565acbbb24a2ca863178df181a3ff4c,У тебя это в телефоне?,https://t.me/nn4st/246212,t.me,2025-08-08T09:30:37+00:00,<br />У тебя это в телефоне? А если окно с 4 закрыть и опять открыть? Или может 5 потому что платно а 4 бесплатно 🧐
7a3580cb9098fbb5b68ded118d089cdd,Разворачиваются с утра.,https://t.me/nn4st/246211,t.me,2025-08-08T09:24:23+00:00,"<br />Разворачиваются с утра. У меня два окна открыто, так удобнее. В одном 5, а в другом никак не сбросить четверку... Получается занятный раскардаш. Хз что дальше будет 😂"
f13de1435328243795877d76fe7352ba,<br />Лума дриммашина так раньше делала,https://t.me/nn4st/246210,t.me,2025-08-08T09:22:36+00:00,<br />Лума дриммашина так раньше делала
dd8b9e782aa4a8925c19c290374e1321,Новый чат гпт очень философский.,https://t.me/nn4st/246209,t.me,2025-08-08T09:19:20+00:00,"<br />Новый чат гпт очень философский. Хотела вернуть все как было раньше, переключить на 4о, чтобы сравнить, а фихушки вам, живите с тем, что теперь есть."
f328647b0f2dc93dc2cbcd11e5256ab4,[Photo],https://t.me/nn4st/246208,t.me,2025-08-08T09:18:33+00:00,"<a href=""https://tg.i-c-a.su/media/nn4st/246208/5237831352299155838_y_2.jpg"" rel=""nofollow"" target=""_blank""><img src=""https://tg.i-c-a.su/media/nn4st/246208/preview/thumb.jpeg"" /></a><br /><br />"
c4625b605ace68b10ca00bd23da6a71a,"<br /><a href=""https://t.me/combot/cas?startapp=7750193691"">Кира</a> has been banned! Reason: CAS ba…",https://t.me/fotostoki_ru_chat/32617,t.me,2025-08-08T09:30:58+00:00,"<br /><a href=""https://t.me/combot/cas?startapp=7750193691"">Кира</a> has been banned! Reason: CAS ban."
4af1f7e6bf5f0338bb429784c14f6bac,<br />Не ИИ. Просто рисованный вектор. Во фреско.,https://t.me/fotostoki_ru_chat/32616,t.me,2025-08-08T09:30:23+00:00,<br />Не ИИ. Просто рисованный вектор. Во фреско.
af5428af697bcb9586e281b9f5155f62,"<br />у тебя обычный вектор, не ии?",https://t.me/fotostoki_ru_chat/32615,t.me,2025-08-08T09:29:58+00:00,"<br />у тебя обычный вектор, не ии?"
f44c067754214fce21e758389ee4f4bd,Спасибо 🥰 Они даже со скетчами не верят.,https://t.me/fotostoki_ru_chat/32612,t.me,2025-08-08T09:26:22+00:00,"<br />Спасибо 🥰 Они даже со скетчами не верят. Приходится фоткать как-то в процессе, с руками. Что сидела и рисовала. Такое проходит."
30cb6d68ba52b1b1229c0d84fea294d6,"Адоб стал отклонять вектор, да.",https://t.me/fotostoki_ru_chat/32611,t.me,2025-08-08T09:25:38+00:00,"<br />Адоб стал отклонять вектор, да. С формулировкой «это уже есть в нашей базе». Что-то похожее видимо есть. Пару работ отклонил, которых у меня нет в портфеле. И штук 10 отклонил, которые были симилярами. Типа есть набор, а есть одиночные. Вот набор отклонил, одиночные принял. (Так как одиночные раньше отправила). <br /><br />А айсток везде ИИ видит."
bb5563f27c55a15668af7efcd359999d,это был пример примитивного результата по примитивному промпту 😂😂😂но уровень примитива выро [...],https://t.me/nn4st/246263,t.me,2025-08-08T10:29:10+00:00,"<br />это был пример примитивного результата по примитивному промпту 😂😂😂<br /><br />но уровень примитива вырос, да еще как (если вспомнить то, что было всего 2 годика назад)"
dcec4170b916f0f4cacf69a4f7debcc1,Тут уже накидали.,https://t.me/nn4st/246262,t.me,2025-08-08T10:29:09+00:00,"<br />Тут уже накидали. Попозже, если будет не лень, могу один и тот же промпт в разных сетках сделать"
b365ecf9a4b06e2f0245d1d9495b0f41,"А, сорри, я сперва подумал, что это пример того, как хорошо получилось, если потрудиться с про [...]",https://t.me/nn4st/246261,t.me,2025-08-08T10:28:12+00:00,"<br />А, сорри, я сперва подумал, что это пример того, как хорошо получилось, если потрудиться с промптом))<br /><br />Я не утверждаю, что вообще невозможно добиться фотореализма от этой сетки, но если учесть ее скорость, то игра не стоит свеч, имхо"
8c6da48e6b790aa946a0e4799f36626e,[Media],https://t.me/nn4st/246260,t.me,2025-08-08T10:25:38+00:00,"<a href=""https://tg.i-c-a.su/media/nn4st/246260/-2147483648_-213290_5233309992525787371.webp"" rel=""nofollow"" target=""_blank""><img src=""https://tg.i-c-a.su/media/nn4st/246260/preview/thumb.jpeg"" /></a><br /><br />"
b67bcbebb74196da75687dd95b24146b,"Если написать, что картинка не реалистичная плохая , то он соглашается и пишет что сейчас испр [...]",https://t.me/nn4st/246259,t.me,2025-08-08T10:24:27+00:00,"<br />Если написать, что картинка не реалистичная плохая , то он соглашается и пишет что сейчас исправит и создает новую более реалистичную, но я вам не покажу уже"
c1c7ad5ff3535afa6d73cf66ade20fb4,"Мы собственно и обсуждали, что пластик, все еще далекий от реализма.",https://t.me/nn4st/246258,t.me,2025-08-08T10:23:00+00:00,"<br />Мы собственно и обсуждали, что пластик, все еще далекий от реализма. Но потребители уже привыкли (что конечно печально, но это реальность). Банальный фотореализм шлепать в нейре - уже такое себе, все им забито"
78c32f1cf2e57e430521a2f6b7cf144a,"Что я непонятно сформулировала про то, что это примитив?",https://t.me/nn4st/246257,t.me,2025-08-08T10:21:51+00:00,"<br />Что я непонятно сформулировала про то, что это примитив? ))"
e8526454d65d633dd6f72ab6063b7c70,"Покажи со стока пример, чтобы сравнить, интересно 🤔",https://t.me/nn4st/246256,t.me,2025-08-08T10:21:42+00:00,"<br />Покажи со стока пример, чтобы сравнить, интересно 🤔"
5a3559b0ecc333fee9d6e1ebfdc34ee1,[Photo],https://t.me/nn4st/246255,t.me,2025-08-08T10:21:02+00:00,"<a href=""https://tg.i-c-a.su/media/nn4st/246255/5237996764374626878_y_2.jpg"" rel=""nofollow"" target=""_blank""><img src=""https://tg.i-c-a.su/media/nn4st/246255/preview/thumb.jpeg"" /></a><br /><br />"
baa75bab1646f63ddad4c34954a43932,"Может, у меня просто насмотренность слишком высокая.Мне это картинка кажется нефотореалистично [...]",https://t.me/nn4st/246254,t.me,2025-08-08T10:20:23+00:00,"<br />Может, у меня просто насмотренность слишком высокая.<br /><br />Мне это картинка кажется нефотореалистичной и безжизненной😁<br /><br />Впервые я фотореализм увидел у Ideogram. Но там вблизи ужас. <br /><br />Правда вот последняя версия Seadream меня впечатлила. Но там нет безлимитки."
d6e83f80c0a460056c08367a86c6fd68,Don’t Make These 5 Common Portrait Photography Mistakes,https://www.diyphotography.net/dont-make-these-5-common-portrait-photography-mistakes/,www.diyphotography.net,2025-08-08T11:18:33+00:00,"<p>Portrait photography may seem simple. After all, you just point your camera at someone and click, right? Well, not quite, it&#8217;s a little bit more...</p> <p><small>The post <a href=""https://www.diyphotography.net/dont-make-these-5-common-portrait-photography-mistakes/"">Don&#8217;t Make These 5 Common Portrait Photography Mistakes</a> appeared first on <a href=""https://www.diyphotography.net"">DIY Photography</a>.</small></p>"
08b70aa3cbeb6d7ab6665d85749b5e07,A Cosmic Bridge Lights up the Night: DECam’s Portrait of Abell 3667,https://www.diyphotography.net/a-cosmic-bridge-lights-up-the-night-decams-portrait-of-abell-3667/,www.diyphotography.net,2025-08-08T03:23:38+00:00,"<p>A new cosmic portrait by Dark Energy Camera reveals a tale of power, time, and cosmic design. The galaxy cluster Abell 3667, nestled about 700...</p> <p><small>The post <a href=""https://www.diyphotography.net/a-cosmic-bridge-lights-up-the-night-decams-portrait-of-abell-3667/"">A Cosmic Bridge Lights up the Night: DECam’s Portrait of Abell 3667</a> appeared first on <a href=""https://www.diyphotography.net"">DIY Photography</a>.</small></p>"
95ce38213bdb6ce82b97c1f7caca6332,Wildlife Photography Tips for Meaningful Images with Melanie Randall,https://www.diyphotography.net/wildlife-photography-tips-for-meaningful-images-with-melanie-randall/,www.diyphotography.net,2025-08-07T17:36:23+00:00,"<p>Curious how to capture soft, emotional wildlife photos without needing the most expensive gear or years of experience? You’re in the right place. We spoke...</p> <p><small>The post <a href=""https://www.diyphotography.net/wildlife-photography-tips-for-meaningful-images-with-melanie-randall/"">Wildlife Photography Tips for Meaningful Images with Melanie Randall</a> appeared first on <a href=""https://www.diyphotography.net"">DIY Photography</a>.</small></p>"
fd500c34863edc027b1f6f7952a5cb28,8 Photography Tips for Beginners in 2025,https://www.diyphotography.net/photography-tips-for-beginners-in-2025/,www.diyphotography.net,2025-08-07T16:25:25+00:00,"<p>Learn essential photography tips that transform basic snapshots into stunning images faster than you think. These practical photography techniques cover camera basics, composition rules, lighting secrets, and common mistakes to avoid for beginners in 2025.</p> <p><small>The post <a href=""https://www.diyphotography.net/photography-tips-for-beginners-in-2025/"">8 Photography Tips for Beginners in 2025</a> appeared first on <a href=""https://www.diyphotography.net"">DIY Photography</a>.</small></p>"
af19e96c0d06faf0928d631a5b901e87,Wanna Be a Rock Star Photographer? Here’s How the Pros Do It,https://www.diyphotography.net/wannabe-a-rock-star-photographer-heres-how-the-pros-do-it/,www.diyphotography.net,2025-08-07T16:00:00+00:00,"<p>Led Zepellin, The Who, The Rolling Stones, The Police&#8230; If you could choose any band or musician to photograph who would it be? The role...</p> <p><small>The post <a href=""https://www.diyphotography.net/wannabe-a-rock-star-photographer-heres-how-the-pros-do-it/"">Wanna Be a Rock Star Photographer? Here&#8217;s How the Pros Do It</a> appeared first on <a href=""https://www.diyphotography.net"">DIY Photography</a>.</small></p>"
2a2fd8df714e93718bf9100464280d4c,15 Popular Types of Photography to Explore in 2025,https://www.diyphotography.net/15-popular-types-of-photography-to-explore-in-2025/,www.diyphotography.net,2025-08-07T15:45:35+00:00,"<p>Explore the different types of photography and unlock creative opportunities for self-expression and artistic exploration through various photography styles.</p> <p><small>The post <a href=""https://www.diyphotography.net/15-popular-types-of-photography-to-explore-in-2025/"">15 Popular Types of Photography to Explore in 2025</a> appeared first on <a href=""https://www.diyphotography.net"">DIY Photography</a>.</small></p>"
beb321b746b87abd5dad14e76ccde669,Rolling Your Dobsonian with Ease: Dob Truks to the Rescue,https://www.diyphotography.net/rolling-your-dobsonian-with-ease-dob-truks-to-the-rescue/,www.diyphotography.net,2025-08-07T14:00:00+00:00,"<p>Owning a Dobsonian telescope gives you unmatched views of the cosmos. But moving a bulky Dob ever-presently tests your back and patience. Astro TUFF Truk...</p> <p><small>The post <a href=""https://www.diyphotography.net/rolling-your-dobsonian-with-ease-dob-truks-to-the-rescue/"">Rolling Your Dobsonian with Ease: Dob Truks to the Rescue</a> appeared first on <a href=""https://www.diyphotography.net"">DIY Photography</a>.</small></p>"
ae2811589cdd2e46ceeae23825f723cc,Tourist Hit with $231K Fine for Flying Drone Illegally at Spanish Festival,https://www.diyphotography.net/tourist-hit-with-231k-fine-for-flying-drone-illegally-at-spanish-festival/,www.diyphotography.net,2025-08-07T11:48:11+00:00,"<p>If you&#8217;re planning to pack your drone for a European holiday, you might want to think twice about it, or at least brush up on...</p> <p><small>The post <a href=""https://www.diyphotography.net/tourist-hit-with-231k-fine-for-flying-drone-illegally-at-spanish-festival/"">Tourist Hit with $231K Fine for Flying Drone Illegally at Spanish Festival</a> appeared first on <a href=""https://www.diyphotography.net"">DIY Photography</a>.</small></p>"
a14717ed327f1675cdae432d9a0c8f0c,SVvbony SV555 Astrograph: Your Portable Window to the Deep-Sky,https://www.diyphotography.net/svvbony-sv555-astrograph-your-portable-window-to-the-deep-sky/,www.diyphotography.net,2025-08-07T02:17:24+00:00,"<p>The night sky holds secrets. The Svbony SV555 unlocks some of them. It brings stars, nebulae, and galaxies into crisp focus and blends optical power...</p> <p><small>The post <a href=""https://www.diyphotography.net/svvbony-sv555-astrograph-your-portable-window-to-the-deep-sky/"">SVvbony SV555 Astrograph: Your Portable Window to the Deep-Sky</a> appeared first on <a href=""https://www.diyphotography.net"">DIY Photography</a>.</small></p>"
e6c19e12389d21d83aa7b0f935d05cbc,"[Media] Практическое руководство для стокеров подсказывает, как снимать инклюзивный контент бе [...]",https://t.me/be_trendy_stocker/11223,t.me,2025-08-08T10:47:01+00:00,"<br />Практическое руководство для стокеров подсказывает, как снимать инклюзивный контент без клише - например, людей с инвалидностью в работе, спорте, путешествиях и быту. В фокусе адаптивные технологии, доступная среда и реальные жизненные ситуации <br /><br /><a href=""https://www.tagwithai.com/blog/practical-tips-for-stock-contributors-creating/"">https://www.tagwithai.com/blog/practical-tips-for-stock-contributors-creating/</a><br /><br /><br />📌 <a href=""https://t.me/be_trendy_stocker"">ТГ BE…"
4704f6f1fc5e008923de4ce23857ee7a,[Photo],https://t.me/be_trendy_stocker/11214,t.me,2025-08-06T07:25:18+00:00,"<a href=""https://tg.i-c-a.su/media/be_trendy_stocker/11214/5195372830324283589_y_2.jpg"" rel=""nofollow"" target=""_blank""><img src=""https://tg.i-c-a.su/media/be_trendy_stocker/11214/preview/thumb.jpeg"" /></a><br /><a href=""https://tg.i-c-a.su/media/be_trendy_stocker/11215/5195372830324283587_y_2.jpg"" rel=""nofollow"" target=""_blank""><img src=""https://tg.i-c-a.su/media/be_trendy_stocker/11215/preview/thumb.jpeg"" /></a><br /><a href=""https://tg.i-c-a.su/media/be_trendy_stocker/11216/5195372830324283593…"
d1d1de014c795b71e275f75dbc7d9fea,📉 КПД автора на микростоках падает.,https://t.me/supermicrostock/1612,t.me,2025-08-08T10:38:05+00:00,"<br /><b>📉 КПД автора на микростоках падает. И это надолго</b><br /><br />Самый большой вызов с которым столкнулись авторы на микростоках в последние 2-3 года — это снижение авторского КПД. Что я имею ввиду и как я вижу ситуацию? Мы проводим примерно одинаковое время за работой, что и пару лет назад, но отдача, выражаемая в деньгах падает. Условно, если в прошлом час нашей работы приносил 12$, то сейчас 8$. И ничего с этим не поделать. Эта цифра будет ползти вниз и дальше.<br /><b><br />🔹 Почему…"
c7a8131283e8622f214039d407523ac5,Godox Just Launched the Tiny iT20/iT22 iFlash—Is It the Perfect Pocket Flash?,https://www.diyphotography.net/godox-just-launched-the-tiny-it20-it22-iflash-is-it-the-perfect-pocket-flash/,www.diyphotography.net,2025-08-08T12:00:52+00:00,"<p>Godox has launched its new Tiny iT20/iT22 iFlash. Are you fed up with carrying around bulky and heavy flash units? Wouldn&#8217;t it be great to...</p> <p><small>The post <a href=""https://www.diyphotography.net/godox-just-launched-the-tiny-it20-it22-iflash-is-it-the-perfect-pocket-flash/"">Godox Just Launched the Tiny iT20/iT22 iFlash—Is It the Perfect Pocket Flash?</a> appeared first on <a href=""https://www.diyphotography.net"">DIY Photography</a>.</small></p>"
66c526733358325e94cd89773148ea1d,Hubble’s Sharpest Portrait of a Visitor from the Stars: Comet 3I/ATLAS,https://www.diyphotography.net/hubbles-sharpest-portrait-of-a-visitor-from-the-stars-comet-3i-atlas/,www.diyphotography.net,2025-08-08T12:00:00+00:00,"<p>On 21 July 2025, the Hubble Space Telescope captured a remarkable sight. It took the clearest image yet of 3I/ATLAS, a comet from another star...</p> <p><small>The post <a href=""https://www.diyphotography.net/hubbles-sharpest-portrait-of-a-visitor-from-the-stars-comet-3i-atlas/"">Hubble’s Sharpest Portrait of a Visitor from the Stars: Comet 3I/ATLAS</a> appeared first on <a href=""https://www.diyphotography.net"">DIY Photography</a>.</small></p>"
8404e6d9d3a2c09b234669b8e78ad98f,Follow These Long Exposure Tutorials To Make Your Ordinary Images Look Extraordinary,https://www.lightstalking.com/long-exposure-photography-tutorials/,www.lightstalking.com,2025-08-08T12:00:00+00:00,"<p>Long exposure photography can be applied to many genre of photography besides the landscape photography where this technique is more commonly used. In this article, we have put together a bunch of tutorials for you to get an understanding of long exposure photography and improve your skills.</p> <p>The post <a href=""https://www.lightstalking.com/long-exposure-photography-tutorials/"">Follow These Long Exposure Tutorials To Make Your Ordinary Images Look Extraordinary</a> appeared first on <a h…"
af3c9204616114ab98d1e15aeba258c2,<br />Так он об этом и писал выше,https://t.me/nn4st/246356,t.me,2025-08-08T13:00:59+00:00,<br />Так он об этом и писал выше
68a85b5bfb8790df8ed641804ad453d8,<br />Но теория зачёт)),https://t.me/nn4st/246355,t.me,2025-08-08T12:58:48+00:00,<br />Но теория зачёт))
8611745cd3f3846a3c5f96c64ebea98e,"Это не слова, которые не удалось добавить к промту..",https://t.me/nn4st/246354,t.me,2025-08-08T12:58:11+00:00,"<br />Это не слова, которые не удалось добавить к промту.. эти слова - типо айди генерации, на каждую разные"
a009a2d8fd8cdd60fe3c9be0eb148af2,<br />Следите за руками,https://t.me/nn4st/246353,t.me,2025-08-08T12:42:45+00:00,<br />Следите за руками
3212ee99128c261fe0d2ce1e13fd40bf,[Video],https://t.me/nn4st/246352,t.me,2025-08-08T12:42:36+00:00,"<a href=""https://tg.i-c-a.su/media/nn4st/246352/IMG_8398_5237996763918401092.MP4"" rel=""nofollow"" target=""_blank""><img src=""https://tg.i-c-a.su/media/nn4st/246352/preview/thumb.jpeg"" /></a><br /><br />"
6829f474851520f156a12aff7212bdeb,"Нет, не чушь.",https://t.me/nn4st/246351,t.me,2025-08-08T12:41:52+00:00,"<br />Нет, не чушь. Там во время ошибок было написано что-то типа &quot;не удалось добавить к промпту уникальные слова ball-car-sky&quot;.<br />И при каждой ошибке эти слова менялись.<br /><br />У некоторых моделей есть рандомное семя, выраженное числом, тут, судя по всему, словами."
c566084a73e4389131b43682bbdf8f53,"И если это в телефоне на маленьком экранчике то вообще не отличить, ну только если присмотреться",https://t.me/nn4st/246350,t.me,2025-08-08T12:40:46+00:00,"<br />И если это в телефоне на маленьком экранчике то вообще не отличить, ну только если присмотреться"
c2b3969a7f00f4e2b20391253b522af9,[Photo],https://t.me/nn4st/246349,t.me,2025-08-08T12:40:35+00:00,"<a href=""https://tg.i-c-a.su/media/nn4st/246349/5237996764374627198_y_2.jpg"" rel=""nofollow"" target=""_blank""><img src=""https://tg.i-c-a.su/media/nn4st/246349/preview/thumb.jpeg"" /></a><br /><br />"
d098ba21e9fcc97290d1f60d8e03d1f9,"Если бы да кабы во рту росли грибы, то был бы не рот, а целый огород))",https://t.me/nn4st/246348,t.me,2025-08-08T12:39:27+00:00,"<br />Если бы да кабы во рту росли грибы, то был бы не рот, а целый огород))"
7360020386cf8a65a8fc7ce2eb0c66f2,"При слепом тесте, если взять нейро и обычные фотки, все это ограничить, например, до 800 пиксе [...]",https://t.me/nn4st/246347,t.me,2025-08-08T12:35:36+00:00,"<br />При слепом тесте, если взять нейро и обычные фотки, все это ограничить, например, до 800 пиксехей по длинной стороне, то иногда вполне можно нейронку за реал принять, если говорить про Midjourney, Ideogram, Dreamina, Kling."
2eb4f571112aa94c005c1297d7291bfd,Это более похоже.,https://t.me/fotostoki_ru_chat/32626,t.me,2025-08-08T11:37:33+00:00,"<br />Это более похоже. Так как ии контента валом, + вектор еще ИИшный наплывает."
6e54e642e0a60036d63efcdddac08e71,"<br />По-моему, у них просто план по отказам и приёмке",https://t.me/fotostoki_ru_chat/32625,t.me,2025-08-08T11:35:06+00:00,"<br />По-моему, у них просто план по отказам и приёмке"
53fc1acbd15ac6169963c9d6a0b9fcb6,Да вроде понятно должно быть что у него есть какая то логика или рандом отклонения по похожему.,https://t.me/fotostoki_ru_chat/32624,t.me,2025-08-08T11:34:00+00:00,"<br />Да вроде понятно должно быть что у него есть какая то логика или рандом отклонения по похожему. Это не значит что вы не сможете зеленое яблоко на белом фоне загрузить, потому что подняли неймоверную шумиху авторы."
290713009e6ffc54c6e97ec6cc69851f,"У них, видимо, там алгоритмы какие-то.",https://t.me/fotostoki_ru_chat/32623,t.me,2025-08-08T11:33:38+00:00,"<br />У них, видимо, там алгоритмы какие-то. Возможно, для жирных тем продаваемых есть исключения. Или какой-то % тем берут, а кому-то отклоняют.<br />Фото давно так, ии понятно, еще хуже, но вот и вектор, пожалуйста. 😔"
