uid,title,link,source,published,summary
a488c1524b6c8f61eeb6de48ec11d966,"Sony RX1R III price, specs and availability announced",https://camerajabber.com/photography-news/sony-rx1r-iii-price-specs-availability/,camerajabber.com,2025-07-15T15:07:55+00:00,"Sony Electronics has unveiled the RX1R III, marking the next step in its celebrated line of premium full-frame compact cameras. Designed for photographers who demand uncompromising image quality in a palm-sized body, the RX1R III arrives with headline features including a 61-megapixel full-frame Exmor R CMOS sensor, Sony’s advanced BIONZ XR image processor, and an [&#8230;]"
ec6812168d0ef31defa893332a69a4bb,DJI Power 1000 v2 boosts portable power output,https://camerajabber.com/photography-news/dji-power-1000-v2-boosts-portable-power-output/,camerajabber.com,2025-07-09T12:00:00+00:00,"DJI has announced the Power 1000 v2, a significant update to its flagship portable power station, delivering smarter energy management and improved performance for photographers, filmmakers and content creators on the move. Building on the popularity of the original model, the v2 introduces a range of enhancements that make it more reliable and user-friendly in [&#8230;]"
aacafa2301d608672d04f193e4167016,Upgrade your streaming setup with OBSBOT’s AI webcams,https://camerajabber.com/photography-news/upgrade-your-streaming-setup-with-obsbots-ai-webcams/,camerajabber.com,2025-07-07T17:00:00+00:00,"Thought about your webcam recently? Probably not. Most of us see it as just a basic lens sat atop your monitor or built int, functional, but forgettable. Yet modern webcams have come a long way, and what used to be a basic necessity can now be used boost the quality of your content, teaching, and [&#8230;]"
c79636a45f42a40dc66661f3cf2df393,Analogue Revival: Exploring the Resurgence of Film Photography in 2025,https://camerajabber.com/photography-news/analogue-revival-exploring-the-resurgence-of-film-photography-in-2025/,camerajabber.com,2025-07-03T13:00:41+00:00,"Photography, like many mediums, is no stranger to trends. And while many come and go, one trend that has continued to persist since its pandemic-fuelled resurgence in the early 2020s is film photography. Initially, film saw something of a mild resurgence in the early 2010s, but it wasn&#8217;t until the world was forced into lockdown [&#8230;]"
1488d19b2dc4f63d244c23a2ec8992c3,Video-First Cameras: Is Hybrid Photography at Risk of Becoming an Afterthought?,https://camerajabber.com/photography-news/video-first-cameras-is-hybrid-photography-at-risk-of-becoming-an-afterthought/,camerajabber.com,2025-07-03T14:00:00+00:00,"The past few years have seen some very significant changes in the world of digital photography. The rapid move to mirrorless, the demise of the DSLR and the seemingly never-ending megapixel race has meant that pocket smartphones like the Samsung Galaxy S25 Ultra are now capable of capturing still images containing 200 megapixels. But the [&#8230;]"
50eb2798f95ededc1f10b64b96c980b3,Saramonic unveils TC-NEO wireless timecode sync system,https://camerajabber.com/photography-news/saramonic-unveils-tc-neo-wireless-timecode-sync-system/,camerajabber.com,2025-07-03T02:00:00+00:00,"Saramonic has announced the launch of the TC-NEO, a wireless timecode generator designed to bring precision and simplicity to multi-camera and multi-recorder production workflows. Lightweight, compact, and highly versatile, the TC-NEO aims to eliminate the usual headaches of timecode syncing—long setup times, tangled cabling, and post-production drift—while delivering professional-level accuracy. Weighing just 42.5 grams per [&#8230;]"
40a44158c847c9c341daf867e2d8e23f,Lightroom's New Feature Beats Time-Wasting Presets (VIDEO),https://www.shutterbug.com/content/lightrooms-new-feature-beats-time-wasting-presets-video,www.shutterbug.com,2025-08-05T18:54:21+00:00,"<div class=""field field-name-body field-type-text-with-summary field-label-hidden""><div class=""field-items""><div class=""field-item even""><p>Are you tied of spending hours tweaking sliders or relying upon presets that rarely seem appropriate for the specific task at hand? If so, this straightforward Lightroom tutorial is guaranteed to save you serious time whether you're editing Golden-Hour mountains, misty forests, or unimpressive skies that are lacking in drama.</p> <p>The topic of this eye-ope…"
cbf7064b48ed7f081704177e09bde051,DON’T Let Exposure Clipping Spoil Your Photos (VIDEO),https://www.shutterbug.com/content/don%E2%80%99t-let-exposure-clipping-spoil-your-photos-video,www.shutterbug.com,2025-08-05T16:48:45+00:00,"<div class=""field field-name-body field-type-text-with-summary field-label-hidden""><div class=""field-items""><div class=""field-item even""><p>If you're unfamiliar with the term ""clipping"" it's time we brought you up to speed and revealed how easy it can be to prevent this common occurrence from spoiling the quality of images you shoot in the field. Today's concise explainer from the <a href=""https://www.youtube.com/@SouvenirPhotoPros"" target=""_blank"">Souvenir Photo Pros YouTube channel</a> explain…"
75d4ccee6271f2e689bf84b93c48617c,Stylize Outdoor Photos by Editing Colors Like This (VIDEO),https://www.shutterbug.com/content/stylize-outdoor-photos-editing-colors-video,www.shutterbug.com,2025-08-04T19:58:37+00:00,"<div class=""field field-name-body field-type-text-with-summary field-label-hidden""><div class=""field-items""><div class=""field-item even""><p>We're all looking for ways to capture attention-grabbing outdoor photos that stand out from the crowd, while keeping things looking natural. The Lightroom workflow illustrated below is a lot of fun because it involves experimenting with stylizing your images until you discover a signature look that's easy to replicate in the future.</p> <p>This interesting a…"
4df07d1c87f39b6da530a611ff8a4bf2,Boudoir Basics: A Sensuous Couch Pose for All Body Types (VIDEO),https://www.shutterbug.com/content/boudoir-basics-sensuous-couch-pose-all-body-types-video,www.shutterbug.com,2025-08-04T17:23:25+00:00,"<div class=""field field-name-body field-type-text-with-summary field-label-hidden""><div class=""field-items""><div class=""field-item even""><p>If you're interested in giving boudoir photography a try, the first step is understanding how to pose inexperienced models like a spouse, significant other, or a friend who wants to give it a try. You can also keep things simple by shooting with natural illumination, like light streaming through a window in your home.</p> <p>This quick tutorial from <a href=…"
bfd0cc19805550c814f4e0af24ee1e37,Your Photo Biz Deserves Lumaprints – Here's Why,https://www.shutterbug.com/content/your-photo-biz-deserves-lumaprints-heres-why,www.shutterbug.com,2025-08-04T10:25:01+00:00,"<div class=""field field-name-body field-type-text-with-summary field-label-hidden""><div class=""field-items""><div class=""field-item even""><p>Your expertise at creating compelling photographs and artwork can bring you richer rewards when you partner with the professionals at <a href=""https://www.lumaprints.com/"" target=""_blank"">Lumaprints</a> to handle the order processing, production and delivery.</p> <p><img alt="""" src=""https://www.shutterbug.com/images/22/08042025_LUMAPRINTS1.Small%20Prints.jpg…"
a109ad9e6d9396be3a45755fab1747cd,Mr. Rabbit,https://www.shutterbug.com/content/mr-rabbit,www.shutterbug.com,2025-08-02T18:28:28+00:00,"<div class=""field field-name-field-photo field-type-image field-label-hidden""><div class=""field-items""><div class=""field-item even""><img alt="""" height=""720"" src=""https://www.shutterbug.com/images/styles/960-wide/public/photo_post/%5Buid%5D/IMG_0125.JPG"" width=""896"" /></div></div></div><div class=""field field-name-body field-type-text-with-summary field-label-hidden""><div class=""field-items""><div class=""field-item even""><p>Our front garden friend</p> </div></div></div><div class=""field field-name…"
abbd1da4620fee60d41835e8a396a56a,Master Exposure Without Advanced Technical Skills (VIDEO),https://www.shutterbug.com/content/master-exposure-without-advanced-technical-skills-video,www.shutterbug.com,2025-08-02T16:58:28+00:00,"<div class=""field field-name-body field-type-text-with-summary field-label-hidden""><div class=""field-items""><div class=""field-item even""><p>One of the biggest challenges when shooting in the field under difficult light is nailing exposure in scenes with a wide range of tones, which is why your landscape photos may appear too dark or overly bright with crushed shadows or blown-out highlights.</p> <p>Today's detailed tutorial featuring Ejaz Khan describes a surprisingly simple method for mastering…"
ee4cca05f05d42c908d83a449c133eea,"Prep for Heat, Rain, Cold, Snow & Chipmunk Attacks",https://www.shutterbug.com/content/prep-heat-rain-cold-snow-chipmunk-attacks,www.shutterbug.com,2025-08-01T20:09:49+00:00,"<div class=""field field-name-body field-type-text-with-summary field-label-hidden""><div class=""field-items""><div class=""field-item even""><p>When it's so hot that fire hydrants hold signs that read, <em>""Dogs Welcome!""</em> or so cold that you have to chew your vodka shooter, photographers must take special precautions to maintain focus. Here are the products that are alleged to protect you from everything except <a href=""https://www.verywellmind.com/arachibutyrophobia-2671777"" target=""_blank"">ar…"
5a428d7a324cbd599835c015b4b70449,The New AI Harmonize Tool: Beyond the Basics of 1-Click Composite Photos (VIDEO),https://www.shutterbug.com/content/new-ai-harmonize-tool-beyond-basics-1-click-composite-photos-video,www.shutterbug.com,2025-08-01T18:46:32+00:00,"<div class=""field field-name-body field-type-text-with-summary field-label-hidden""><div class=""field-items""><div class=""field-item even""><p>Earlier this week we brought you a quick tutorial from the highly regarded <a href=""https://www.youtube.com/@PhotoshopTrainingChannel"" target=""_blank"">Photoshop Training Channel</a> that reveals what one Adobe expert says are his five favorite features in the game-changing late-July Photoshop update. Instructor Jesus Ramirez is back again today with a deep d…"
250cc7622178517295e161bccd14dc7d,5 Top Features in Photoshop's Game-Changing July Update (VIDEO),https://www.shutterbug.com/content/5-top-features-photoshops-game-changing-july-update-video,www.shutterbug.com,2025-07-31T18:20:28+00:00,"<div class=""field field-name-body field-type-text-with-summary field-label-hidden""><div class=""field-items""><div class=""field-item even""><p>Adobe's July Photoshop update has dropped and it's packed with powerful new features. This overview from the <a href=""https://www.youtube.com/@PhotoshopTrainingChannel"" target=""_blank"">Photoshop Training Channel</a> takes a quick dive into what a post-processing expert say are his five favorite new features.</p> <p>We often turn to instructor Jesus Ramirez w…"
344f8fe09023f12d4c0f4ac0e75bdc02,Black Swallowtails,https://www.shutterbug.com/content/black-swallowtails,www.shutterbug.com,2025-07-31T17:34:43+00:00,"<div class=""field field-name-field-photo field-type-image field-label-hidden""><div class=""field-items""><div class=""field-item even""><img alt="""" height=""720"" src=""https://www.shutterbug.com/images/styles/960-wide/public/photo_post/%5Buid%5D/July%2027_0.jpg"" width=""956"" /></div></div></div><div class=""field field-name-body field-type-text-with-summary field-label-hidden""><div class=""field-items""><div class=""field-item even""><p>A pair of black swallowtails share a lavender beebalm flower. The backg…"
220d32d44b29f2bde5c379aa9058c8e1,Restore Lost Detail in Photos with Featureless White Skies (VIDEO),https://www.shutterbug.com/content/restore-lost-detail-photos-featureless-white-skies-video,www.shutterbug.com,2025-07-31T16:26:31+00:00,"<div class=""field field-name-body field-type-text-with-summary field-label-hidden""><div class=""field-items""><div class=""field-item even""><p>Today we're taking a quick look at boring white skies, and a very simple workflow for restoring lost detail that you didn't realize was actually there or thought was impossible to recover. It's all about understanding how to use Lightroom's easy-to-use Select Sky tool to get the job done to perfection.</p> <p>Instructor Mark McGee kicks off the video with a…"
b6027b7b2a2da1ec419dec687d38be89,"Create ""Impossible"" Photos with this Time-Proven Technique (VIDEO)",https://www.shutterbug.com/content/create-impossible-photos-time-proven-technique-video,www.shutterbug.com,2025-07-30T18:40:38+00:00,"<div class=""field field-name-body field-type-text-with-summary field-label-hidden""><div class=""field-items""><div class=""field-item even""><p>Today's detailed post-processing tutorial from the <a href=""https://www.youtube.com/@ThePhlogPhotography"" target=""_blank"">PHLOG Photography YouTube channel</a> demonstrates a straightforward technique for creating what one of&nbsp;our favorite pros refers to as ""impossible"" photos. In fact he says that you'll achieve ""otherworldly"" results—not due to outland…"
492b82d3c00f7c5fb228cd166c5f3936,Customize Photoshop for a Personalized Workspace (VIDEO),https://www.shutterbug.com/content/customize-photoshop-personalized-workspace-video,www.shutterbug.com,2025-07-30T16:26:19+00:00,"<div class=""field field-name-body field-type-text-with-summary field-label-hidden""><div class=""field-items""><div class=""field-item even""><p>Photoshop can be bewildering for beginners and experienced amateurs alike because of the vast array of features available. In essence, all this versatility comes at the cost of a confusing workspace that makes your favorite tools difficult to find.</p> <p>The video below from the popular <a href=""https://www.youtube.com/@phlearn"" target=""_blank"">PHLEARN YouT…"
77ee11b1d8340d29eaf656e2be6b7743,Three Top Tips for Tantalizing Travel Photos (VIDEO),https://www.shutterbug.com/content/three-top-tips-tantalizing-travel-photos-video,www.shutterbug.com,2025-07-29T19:00:45+00:00,"<div class=""field field-name-body field-type-text-with-summary field-label-hidden""><div class=""field-items""><div class=""field-item even""><p>Summer or early fall is when many of us go on vacation, whether it's a quick weekend jaunt to the beach, a flight across the country, or a carefully planned international destination. So buckle up and spend the next nine minutes learning how to commemorate your trip with beautiful photographs rather than mere snapshots that quickly fade from memory.</p> <p><…"
bc3840d38935c24edbbe639b0f418b75,Hate Editing? Try These Lightroom Tips,https://www.lightstalking.com/hate-editing-try-lightroom-tips/,www.lightstalking.com,2025-08-05T12:00:00+00:00,"<p>For some, poring over Lightroom for hours on end to create the perfect edit, is the only way to go. For others, the mere thought of sitting down at a computer and fashioning raws into something more usable is at best an inspiration for procrastination and at worst something to avoid all together.<br /> Lightroom, particularly if you do not use it much, can be a daunting and overwhelming program. But it doesn't have to be that way. If you adhere to the 1/99% rule you will soon find yourself ge…"
98c17bf83a7016a57d05c30aefd3fd1e,"Sheep, Trees and Puppies – The Weekly Light Stalking Community Update",https://www.lightstalking.com/community-update/,www.lightstalking.com,2025-08-04T02:10:25+00:00,"<p>Welcome to our weekly community wrapup.&#160; It's been another cracker on the Light Stalking forums with some wonderful photography. Both discuss produced.&#160; Let's start with the photo of the week. &#160;This one,&#160; judged by Federico,&#160; is a dip touch of some art by Patrick.&#160; you can read about Federico's logic for his judgment decisions over [&#8230;]</p> <p>The post <a href=""https://www.lightstalking.com/community-update/"">Sheep, Trees and Puppies &#8211; The Weekly Light…"
ada0aa872f2192664d71282000bc1cc8,Check Out These Tutorials To Capture Unique Urban Photos,https://www.lightstalking.com/urban-photos-tutorials/,www.lightstalking.com,2025-07-31T12:00:00+00:00,"<p>Urban spaces or cities provide opportunities for several genre of photography like architecture, street, urban wildlife, etc. It is always recommended to scout locations beforehand, get to know the area and study how light falls in a particular area during certain times of the day, etc., so you can come back with very compelling photos.</p> <p>Here are some tutorials that we have put together, so you can get some ideas and be inspired to photograph in urban spaces.</p> <p>The post <a href=""ht…"
d777ca7a88a5a227aca8556e0beb5e74,Antigravity Has Announced World’s First 360 Drone,https://www.lightstalking.com/antigravity-360-drone/,www.lightstalking.com,2025-07-30T12:33:00+00:00,"<p>Insta360 which is a global company known for 360 imaging has announced the launch of Antigravity, which is a new independent drone brand developed by Insta360 in collaboration with third parties. Antigravity aims to redefine aerial imaging and is expected to launch with user-friendly controls that will help with creative aerial imaging.</p> <p>The post <a href=""https://www.lightstalking.com/antigravity-360-drone/"">Antigravity Has Announced World&#8217;s First 360 Drone</a> appeared first on <…"
ff193282714d58b6941a3d56a91e3207,Why You Should Embrace Your Photography Fails,https://www.lightstalking.com/why-you-should-embrace-your-photography-fails/,www.lightstalking.com,2025-07-29T12:00:00+00:00,"<p>If as a beginner you are making lots of mistakes, then the chances are you are shooting often and learning lots. Today we are going to look at why you should embrace your photography fails. </p> <p>The post <a href=""https://www.lightstalking.com/why-you-should-embrace-your-photography-fails/"">Why You Should Embrace Your Photography Fails</a> appeared first on <a href=""https://www.lightstalking.com"">Light Stalking</a>.</p>"
f7b712b2249b5b0397622366f8b7d141,Godox Has Announced Ultra Compact Affordable Flash – The New iT20/iT22,https://www.lightstalking.com/godox-it20-it22/,www.lightstalking.com,2025-07-24T12:00:00+00:00,"<p>Godox, a company popularly known for photography lighting equipment, has recently released a couple of mini TTL flashes that are ultra compact and will easily fit into your pocket. These camera flashes are perfect for both indoor and outdoor photography use, and come with magnetic accessories for quick switching between light effects. </p> <p>The post <a href=""https://www.lightstalking.com/godox-it20-it22/"">Godox Has Announced Ultra Compact Affordable Flash &#8211; The New iT20/iT22</a> appea…"
76893c54bdcd02176d6388eb2021e187,"Foreground, Middle Ground, and Background in Photography",https://www.slrlounge.com/foreground-middle-ground-and-background-in-photography/,www.slrlounge.com,2025-08-05T18:38:05+00:00,"The difference between a good photo and a great photo often comes down to its composition.&#160; A composition with multiple layers is often more complex and interesting.&#160; The three layers in a photograph, a video, or a painting are 1) the foreground, 2) middle ground, and 3) background. Understanding and visualizing these layers helps to ... <a class=""read-more"" href=""https://www.slrlounge.com/foreground-middle-ground-and-background-in-photography/"" title=""Foreground, Middle Ground, and Ba…"
c53cbabb24042a166ee1569727a3ee89,Facebook Ads for Photographers: Avoid These 5 Most Common Mistakes,https://www.slrlounge.com/facebook-ads-for-photographers/,www.slrlounge.com,2025-08-05T17:55:18+00:00,"Marketing is always evolving, but one principle never changes: you need to show up where your clients spend their time. Today, that place is social media—especially Instagram. For years, we championed organic marketing strategies like SEO and social media posts, and we were firmly against most forms of paid advertising—whether it was Google Ads, paid directories, ... <a class=""read-more"" href=""https://www.slrlounge.com/facebook-ads-for-photographers/"" title=""Facebook Ads for Photographers: Avoid…"
4aebe20316ac7c5f18f0852d2054cee4,9 Essential Tips for Beach Maternity Photos,https://www.slrlounge.com/beach-maternity-photos-tips-ideas-examples/,www.slrlounge.com,2025-08-04T21:13:27+00:00,"Your client is pregnant and wants a beautiful backdrop for her maternity photos. What better location than a stunning sunset at the beach to commemorate this time as a new mother-to-be. In a previous article, we covered general maternity photography tips. Now, we&#8217;ll narrow it down and share some tips and ideas for beach maternity ... <a class=""read-more"" href=""https://www.slrlounge.com/beach-maternity-photos-tips-ideas-examples/"" title=""9 Essential Tips for Beach Maternity Photos"">Read mor…"
81f8ef777177ebfb9d5fb009c61b2dae,5 Easy Family Photo Poses,https://www.slrlounge.com/family-portrait-poses/,www.slrlounge.com,2025-08-03T16:57:28+00:00,Learn these 5 easy poses to help you on every family portrait session!
503e443200c146f29daf411a3521b51d,10 Golden Hour Photography Tips For Better Photography,https://www.slrlounge.com/golden-hour-photography-2/,www.slrlounge.com,2025-08-03T00:50:26+00:00,"If you&#8217;re a photographer, then you likely know that the golden hour is one of the best times to take pictures. The lighting is soft, directional, and whimsical; and the colors in the sky are beautiful and rich.&#160; While every photographer in the world likely has access to golden hour, not all of them use ... <a class=""read-more"" href=""https://www.slrlounge.com/golden-hour-photography-2/"" title=""10 Golden Hour Photography Tips For Better Photography"">Read more</a>"
7da6a72c48d890fc5ca9ed3d794e2792,Complete Headshot Posing Guide,https://www.slrlounge.com/how-to-pose-for-a-headshot-the-complete-guide/,www.slrlounge.com,2025-08-01T20:34:04+00:00,"A headshot seems easy enough to photograph. I mean, it’s just a portrait of the client’s face, right? Actually, creating the perfect headshot is an art form that involves more than just a great camera and lighting. It&#8217;s about capturing the essence of a person&#8217;s personality and professionalism in a single frame. In this comprehensive ... <a class=""read-more"" href=""https://www.slrlounge.com/how-to-pose-for-a-headshot-the-complete-guide/"" title=""Complete Headshot Posing Guide"">Read more…"
dcced33fe78c076a37fc0b2ce0bf0af4,Sunset Portrait Photography Tips and Techniques,https://www.slrlounge.com/sunset-portrait-photography-minute-photography/,www.slrlounge.com,2025-08-01T20:06:24+00:00,"Learn how to create stunning, dramatic blue sunset portraits with a single OCF."
f7e7857c36f473c849358ead6dece133,21 Groomsmen Posing Cues From Wedding Photographers,https://www.slrlounge.com/14-groomsmen-posing-cues-from-14-outstanding-wedding-photographers/,www.slrlounge.com,2025-07-31T17:00:26+00:00,Hear what advice wedding industry pros have about groomsmen posing.
057e465484e7d5e18c6603c6e0fed61a,10 Photography Mistakes That Will Destroy Your Creative Dreams (And Your Bank Account),https://fstoppers.com/business/10-photography-mistakes-will-destroy-your-creative-dreams-and-your-bank-account-707717?utm_source=FS_RSS&utm_medium=RSS&utm_campaign=Main_RSS,fstoppers.com,2025-08-05T21:03:01+00:00,"<p><a href=""https://fstoppers.com/business/10-photography-mistakes-will-destroy-your-creative-dreams-and-your-bank-account-707717?utm_source=FS_RSS&amp;utm_medium=RSS&amp;utm_campaign=Main_RSS""><img alt="""" height=""670"" src=""https://cdn.fstoppers.com/styles/large-16-9/s3/lead/2025/07/ing_19043_240855.jpg"" width=""1185"" /></a></p> <p>Every photographer's journey starts with boundless enthusiasm and a camera, but most beginners unknowingly sabotage their progress with costly mistakes that could easi…"
05498143615b6d630c5813eb7f749956,[Media],https://t.me/be_trendy_stocker/11208,t.me,2025-08-05T14:34:01+00:00,"<br /><a href=""https://www.youtube.com/watch?v=xND9acSGCXg"">https://www.youtube.com/watch?v=xND9acSGCXg</a><br /><br /><blockquote cite=""https://www.youtube.com/watch?v=xND9acSGCXg""><cite><b>YouTube</b></cite><b>Загрузил на стоки 1000 ИИ-видео: сколько заработал? Отчёт за июль. Как зарабатывать с помощью ИИ</b>Ссылка на Бусти https://boosty.to/aivenmedia С помощью этого сервиса генерирую видео https://t.me/syntxaibot?start=aff_687822576 Телеграм канал https://t.me/+O67CpJNf84ZmY2Uy ---- Привет!…"
183ac596da1dd0f3d82492dce8273d42,"[Media] Итоги июля 2025 от тревел-стокера: пожары, дроны, покер и $432 доходаИз них $336 — фот [...]",https://t.me/be_trendy_stocker/11207,t.me,2025-08-05T10:34:01+00:00,"<br /><b>Итоги июля 2025 от тревел-стокера: пожары, дроны, покер и $432 дохода</b><br />Из них $336 — фото, $96 — видео. Лидеры по доходу: Adobe Stock ($137), iStock ($90), Shutterstock ($85).<br /><br /><a href=""https://brutallyhonestmicrostock.com/2025/08/01/july-2025-brutally-honest-earnings-report-fires-poker-drones-and-some-passive-income/"">https://brutallyhonestmicrostock.com/2025/08/01/july-2025-brutally-honest-earnings-report-fires-poker-drones-and-some-passive-income/</a> <br /><br /><b…"
