uid,title,link,source,published,summary
3a9d3d12452d2adf3135d209a3a389f5,Никуда он не смотрит.,https://t.me/fotostoki_ru_chat/32622,t.me,2025-08-08T11:31:11+00:00,"<br />Никуда он не смотрит. Специально загрузил фото уличного кота. Удивительно, но на адобе не нашлось ничего похожего и его приняли!"
c76a75d4142e5cd82466428f4b5c02d7,"Да, наверное.",https://t.me/fotostoki_ru_chat/32621,t.me,2025-08-08T11:30:57+00:00,"<br />Да, наверное. Обидно. Это ж ручной вектор. Работы много. С вектором не было такого 🤷‍♀️ уже и до него добрались"
eed3e967bca28c878e0f01544ce56991,"Адоб смотрит по всей своей базе, и если есть что-то похожее то отклоняет.",https://t.me/fotostoki_ru_chat/32620,t.me,2025-08-08T11:28:50+00:00,"<br />Адоб смотрит по всей своей базе, и если есть что-то похожее то отклоняет. Видимо с ИИ картинок это перешло на вектор, т.к. вектор много кто грузит ИИшный и под раздачу попали векторщики."
5d80eaf73a3ba15f25fcb4b768fb91a2,"Адоб, наверное, обновил что-то в приемке.",https://t.me/fotostoki_ru_chat/32619,t.me,2025-08-08T11:14:17+00:00,"<br />Адоб, наверное, обновил что-то в приемке. У меня на этой неделе тоже 2 нестандартных отклонения вектора по симилярству в моей коллекции. Раньше такое принимали."
17af8cc6aad22772f44a056e42f2d242,"[Photo] Похоже справедливость восторжествовала, но 8-10 недель-это сильно, конечно)  И не понятно.",https://t.me/aboutstocks/90881,t.me,2025-08-08T12:30:49+00:00,"<a href=""https://tg.i-c-a.su/media/aboutstocks/90881/5237689502414272719_y_2.jpg"" rel=""nofollow"" target=""_blank""><img src=""https://tg.i-c-a.su/media/aboutstocks/90881/preview/thumb.jpeg"" /></a><br /><br />Похоже справедливость восторжествовала, но 8-10 недель-это сильно, конечно) И не понятно. Если буду грузить симиляры к этим картинкам-мне везде нужно будет указывать этот самый код?..."
8dd8d97e9b2fdf0f3ab6bb5f5290ab84,[Media],https://t.me/be_trendy_stocker/11224,t.me,2025-08-08T14:24:01+00:00,"<br /><a href=""https://www.youtube.com/watch?v=12m4SN-6bzU"">https://www.youtube.com/watch?v=12m4SN-6bzU</a><br /><br /><blockquote cite=""https://www.youtube.com/watch?v=12m4SN-6bzU""><cite><b>YouTube</b></cite><b>How Did He Make $50,000 With No Experience?</b>Michael Schnyder had no experience in videography in 2018 when he decided to start uploading stock footage for passive income. Now he is averaging over $1,200 a month in sales and has over $53,000 in total profits. He did it by specializing…"
4f679c0ad2753d036634c62343a38ff9,[Photo],https://t.me/be_trendy_stocker/11215,t.me,2025-08-06T07:25:19+00:00,"<a href=""https://tg.i-c-a.su/media/be_trendy_stocker/11215/5195372830324283587_y_2.jpg"" rel=""nofollow"" target=""_blank""><img src=""https://tg.i-c-a.su/media/be_trendy_stocker/11215/preview/thumb.jpeg"" /></a><br /><a href=""https://tg.i-c-a.su/media/be_trendy_stocker/11216/5195372830324283593_y_2.jpg"" rel=""nofollow"" target=""_blank""><img src=""https://tg.i-c-a.su/media/be_trendy_stocker/11216/preview/thumb.jpeg"" /></a><br /><br />"
c24c02d4a2d53aa6d7cc6e962c4e226e,@vopolebereza Исправили проверку AI-файлов для Вектизи,https://t.me/StockSubmitter/154518,t.me,2025-08-08T14:24:22+00:00,"<br /><a href=""https://t.me/vopolebereza"">@vopolebereza</a> <br /><br />Исправили проверку AI-файлов для Вектизи"
ca99304b847589c9d2f513c738c021a9,"Да, разобрался, напутано, если поставить галку что это иллюстрация - тогда отправляется",https://t.me/StockSubmitter/154517,t.me,2025-08-08T13:51:57+00:00,"<br />Да, разобрался, напутано, если поставить галку что это иллюстрация - тогда отправляется"
c37967b6090b2f575ad462567b18ff5b,<br />Мы с этим разбираемся,https://t.me/StockSubmitter/154515,t.me,2025-08-08T12:07:07+00:00,<br />Мы с этим разбираемся
910749178c9157e7827c08af80114ebc,<br />все наоборот 🙈,https://t.me/StockSubmitter/154514,t.me,2025-08-08T11:51:31+00:00,<br />все наоборот 🙈
d9f9b058905dc2babe6c17ed2c51e20b,"а вот если добавить галочку, что иллюстрация - возможность отправить появляется)",https://t.me/StockSubmitter/154513,t.me,2025-08-08T11:51:03+00:00,"<br />а вот если добавить галочку, что иллюстрация - возможность отправить появляется)"
c81f12cd6e3d907cf5f245ca801a7f46,<br />такой же косяк с Vecteezy,https://t.me/StockSubmitter/154512,t.me,2025-08-08T11:48:36+00:00,<br />такой же косяк с Vecteezy
dc2024c88ad16e62aec1d0068af29f94,[Photo],https://t.me/StockSubmitter/154511,t.me,2025-08-08T10:59:03+00:00,"<a href=""https://tg.i-c-a.su/media/StockSubmitter/154511/5238248440868240094_x_2.jpg"" rel=""nofollow"" target=""_blank""><img src=""https://tg.i-c-a.su/media/StockSubmitter/154511/preview/thumb.jpeg"" /></a><br /><br />нет, не стоит"
7d60101fcd5e14fd17f224b31e17e083,"Это изменения в защите стока, мы работаем над решениемDumitru",https://t.me/StockSubmitter/154510,t.me,2025-08-08T10:44:19+00:00,"<br />Это изменения в защите стока, мы работаем над решением<br /><a href="""">Dumitru</a>"
6a5a51d8642ec865f1626a73e78434fc,Кто-нибудь через браузер видосы грузит?,https://t.me/StockSubmitter/154509,t.me,2025-08-08T10:37:49+00:00,"<br />Кто-нибудь через браузер видосы грузит? Вчера залил, загрузка вроде прошла, а файлы так и не появились"
6d5b0a8096a6ab31331329efe73173fd,"Говорят фразу, которую можно перевести как &quot;Как дела?",https://t.me/nn4st/246404,t.me,2025-08-08T14:23:45+00:00,"<br />Говорят фразу, которую можно перевести как &quot;Как дела?&quot;. И на этот вопрос обычно не требуется реально отвечать, как и у американцев с англичанами."
d9141a5988888f147637315995964cd8,"<br />Ну тоже как в том анекдоте, сынок как ты какаешь",https://t.me/nn4st/246403,t.me,2025-08-08T14:19:07+00:00,"<br />Ну тоже как в том анекдоте, сынок как ты какаешь"
5bc5cc7a758ce9eda7e36ee75fa4f1f4,<br />Недалеко от правды серьезно)),https://t.me/nn4st/246402,t.me,2025-08-08T14:18:34+00:00,<br />Недалеко от правды серьезно))
b5f7901d89e1b91ad44c32969f4c996f,<br />А в Китае: вы посрали?🤣,https://t.me/nn4st/246400,t.me,2025-08-08T14:18:24+00:00,<br />А в Китае: вы посрали?🤣
c753ba97060f5714d148b8cddc21c579,"Интересно, а как здороваются?",https://t.me/nn4st/246399,t.me,2025-08-08T14:17:12+00:00,"<br />Интересно, а как здороваются? Тут обсуждали, в тайланде спрашивают - вы поели?"
b7d77bd285becc3e96ae2a1e9ace140d,Просто по приколу - друзей повеселить.Я на Филиппинах живу - тут рис это любимая еда у большинства.,https://t.me/nn4st/246398,t.me,2025-08-08T14:14:33+00:00,"<br />Просто по приколу - друзей повеселить.<br /><br />Я на Филиппинах живу - тут рис это любимая еда у большинства. Есть выражение &quot;Rise is life&quot; - аналог нашего &quot;хлеб всему голова&quot;. <br /><br />Я сидел в гостях, решил показать всем возможности нейронок. Придумал текст и попросил нейронку спеть. <br /><br />А потом уже дома подумал, а почему бы клип из этого не сделать?<br />Просмотров он особо не набрал в Ютубе и Тиктоке, но мне было интересно его делать."
c7e2bfdb31d78ccb159aabb21496d84f,Или не можно и тогда просто по приколу и для творчество 😁👍для души,https://t.me/nn4st/246397,t.me,2025-08-08T14:08:38+00:00,<br />Или не можно и тогда просто по приколу и для творчество 😁👍для души
172f5db61e8f69c2f9dbaab4ba4c1de3,А какая связь между художественными навыками и техническими знаниями о работе моделей?Один чел [...],https://t.me/nn4st/246396,t.me,2025-08-08T14:07:25+00:00,"<br />А какая связь между художественными навыками и техническими знаниями о работе моделей?<br /><br />Один человек может хорошо рисовать, но не знать, как изготовить кисть и краски. <br /><br />Другой может всю жизнь изготавливать кисти и краски, но не уметь рисовать."
ed20ca5e50f5dc268ec8e857408c45bc,Но ютюбе и рэп-батл можно монетизировать!,https://t.me/nn4st/246395,t.me,2025-08-08T14:07:16+00:00,<br />Но ютюбе и рэп-батл можно монетизировать! Я все еще настаиваю!😂
6cd8c090cdd29d7cf78178876748f9e5,<br />На ютубе монитизировать можно,https://t.me/nn4st/246394,t.me,2025-08-08T14:05:41+00:00,<br />На ютубе монитизировать можно
fc63bb07d3c4a0b30301d7828316be85,[Video] AI агрегатор Higgsfield добавили GPT 5 в свои сервисы.Он дообучен именно под задачи Hi [...],https://t.me/neyr0graph/3102,t.me,2025-08-08T10:50:54+00:00,"<a href=""https://tg.i-c-a.su/media/neyr0graph/3102/2V_7s8ZlKF9wUP5w_5238229624160288082.mp4"" rel=""nofollow"" target=""_blank""><img src=""https://tg.i-c-a.su/media/neyr0graph/3102/preview/thumb.jpeg"" /></a><br /><a href=""https://tg.i-c-a.su/media/neyr0graph/3103/5238229624616516470_y_2.jpg"" rel=""nofollow"" target=""_blank""><img src=""https://tg.i-c-a.su/media/neyr0graph/3103/preview/thumb.jpeg"" /></a><br /><br />AI агрегатор <a href=""https://higgsfield.ai/"">Higgsfield</a> добавили GPT 5 в свои сервисы.…"
7f068d03c7208263c970cd6b295b9918,И сколько вы вектора загрузили за свой скромный опыт?,https://t.me/fotostoki_ru_chat/32638,t.me,2025-08-08T14:12:34+00:00,<br />И сколько вы вектора загрузили за свой скромный опыт?
5965e8e1e935e2924845d2be0ffd7e76,<br />Имитирую так сказать..,https://t.me/fotostoki_ru_chat/32637,t.me,2025-08-08T14:10:43+00:00,<br />Имитирую так сказать..
b80066e63aca37635baf529dea5ea958,"У меня лимит наступает сразу, стараюсь разбить на 2 части..",https://t.me/fotostoki_ru_chat/32636,t.me,2025-08-08T14:10:19+00:00,"<br />У меня лимит наступает сразу, стараюсь разбить на 2 части.."
e997cedd3519e253d17df2811e20260e,"<br />Я стараюсь каждый день, хотя бы 1 работу)",https://t.me/fotostoki_ru_chat/32635,t.me,2025-08-08T14:02:25+00:00,"<br />Я стараюсь каждый день, хотя бы 1 работу)"
bc943dac3242acf613b2f818862fdb4a,"<br />Спасибо, через мес перезалью. ❤",https://t.me/fotostoki_ru_chat/32634,t.me,2025-08-08T14:01:57+00:00,"<br />Спасибо, через мес перезалью. ❤"
2a15da3aa7dea14997d94134186d5159,"Просто гружу по возможности, прошу если уехал в горы, то при всем желании проблемно грузить бе [...]",https://t.me/fotostoki_ru_chat/32633,t.me,2025-08-08T14:01:37+00:00,"<br />Просто гружу по возможности, прошу если уехал в горы, то при всем желании проблемно грузить без связи 2 недели.."
58650e653aed7276cc1222a25a7a2e04,"Константин, грузить нерегулярно это намного хуже, чем иметь 2 реджекта.Второе, не неделю назад [...]",https://t.me/fotostoki_ru_chat/32632,t.me,2025-08-08T13:59:33+00:00,"<br />Константин, грузить нерегулярно это намного хуже, чем иметь 2 реджекта.<br />Второе, не неделю назад, а мес была проблема с зависанием работ (вектор) на проверке, но недели 2-3 назад все наладилось уже))) <br />Третье, если из-за изобилия ии вектора, ручной вектор начали резать, как уже давно режут растр иллюстрации и фото, то сильно сомневаюсь, что это можно переждать))) это скорее всего тренд новый, и ждать тут нечего."
985fc61d9e6de62620a66ede1ba26609,"За мой скромный опыт, они сначала затягивают , но потом немного отпускают гайки.",https://t.me/fotostoki_ru_chat/32631,t.me,2025-08-08T13:29:03+00:00,"<br />За мой скромный опыт, они сначала затягивают , но потом немного отпускают гайки. Да , понимаю что недельные лимиты теперь считаются по датам загрузок, а не по вторникам.. то ещё веселье, особенно тем у кого много аккаунтов.."
b09b0adae9d6798157db60bb5a68e21d,"Если ручная работа, можно и нужно грузить до победного, постоянно перезагружая реджекты.",https://t.me/fotostoki_ru_chat/32630,t.me,2025-08-08T13:16:02+00:00,"<br />Если ручная работа, можно и нужно грузить до победного, постоянно перезагружая реджекты. А ждать можно бесконечно долго - врядли приемка улучшится, скорее наоборот еще подзакрутят гайки."
246ddfab59bc4cec7d481b9fbfff18b7,"Все обсуждали неделю назад, что проблемы с приемкой вектора и лучше пока не грузить, пока все  [...]",https://t.me/fotostoki_ru_chat/32629,t.me,2025-08-08T13:11:31+00:00,"<br />Все обсуждали неделю назад, что проблемы с приемкой вектора и лучше пока не грузить, пока все наладиться. Но всем срочно горит вектор загрузить, а потом удивляются, что же так произошло."
ae0b8f427d26ed61055f8018a415c65b,<br />А вы уточните этот момент,https://t.me/aboutstocks/90882,t.me,2025-08-08T14:13:12+00:00,<br />А вы уточните этот момент
9ea050806aed86a543a005135d4ebdc6,Evoto VS Photoshop Review: Which Is Better at Portrait Skin Retouching?,https://www.slrlounge.com/evoto-vs-photoshop/,www.slrlounge.com,2025-08-08T15:00:00+00:00,"In the photo editing realm, Photoshop and Evoto AI are two heavyweights. Specifically when it comes to portrait retouching, we have seen a rise of apps that are specifically dedicated to just this purpose, and Evoto has been a front-runner in this realm. Adobe Photoshop offers extensive tools for in-depth work, and these tools go ... <a class=""read-more"" href=""https://www.slrlounge.com/evoto-vs-photoshop/"" title=""Evoto VS Photoshop Review: Which Is Better at Portrait Skin Retouching?"">Read more<…"
b6ee88d81a4d1c3b97ef4b5634de67f0,"прежде всего затем, чтобы когда «стоки всё», остаться с сильным набором умений выше среднего п [...]",https://t.me/nn4st/246405,t.me,2025-08-08T14:40:06+00:00,"<br />прежде всего затем, чтобы когда «стоки всё», остаться с сильным набором умений выше среднего по рынку. А это требует постоянной практики. Кто-то вероятно еще и монетизирует такие учебные ролики, на ютубе или еще где. Я нет."
188b63a5dcabf9f1de62109d7b6656b0,Раньше грузил постоянно и до конца недельного лимита.,https://t.me/fotostoki_ru_chat/32640,t.me,2025-08-08T15:25:21+00:00,<br />Раньше грузил постоянно и до конца недельного лимита. Каждый вторник в 3:00 по Москве лимит обновлялся и давало грузить ещё. Сейчас отъезжал и теперь обнуление Лимита наступает в субботу...
d74c997d3909cfa2ed8b33ddd86d1b7d,"Про недельные лимиты по подробнее, конкретнее про с &quot;даты загрузки&quot;",https://t.me/fotostoki_ru_chat/32639,t.me,2025-08-08T15:19:31+00:00,"<br />Про недельные лимиты по подробнее, конкретнее про с &quot;даты загрузки&quot; как понять"
ff09acb0a90f90891af685b912a0032d,"<br />Слова не мальчика, но мужа!",https://t.me/nn4st/246407,t.me,2025-08-08T15:55:11+00:00,"<br />Слова не мальчика, но мужа!"
65c37fe985e61042f397b1f4145fc704,"<br />Да, возможно. Пробуйте с впн",https://t.me/StockSubmitter/154521,t.me,2025-08-08T16:07:14+00:00,"<br />Да, возможно. Пробуйте с впн"
ec7680f134591181e1ec0ba95cb78faa,<br />Спасибо за оперативность ❤️,https://t.me/StockSubmitter/154520,t.me,2025-08-08T15:40:43+00:00,<br />Спасибо за оперативность ❤️
201bd6a91906986ec6bc4582c70afd06,Стоксабмиттер подвисает на этапе загрузки обновлений.,https://t.me/StockSubmitter/154519,t.me,2025-08-08T15:28:49+00:00,<br />Стоксабмиттер подвисает на этапе загрузки обновлений. Это возможно из-за блокировок в РФ?
d7c1f99ffc93189851ba1ac0ee2b9ddc,"[Video] Мало кто знает, какой неожиданный эффект может быть, если разогреть бутылку колы газов [...]",https://t.me/nn4st/246409,t.me,2025-08-08T16:45:22+00:00,"<a href=""https://tg.i-c-a.su/media/nn4st/246409/%D0%B0_5235778147022044338.mp4"" rel=""nofollow"" target=""_blank""><img src=""https://tg.i-c-a.su/media/nn4st/246409/preview/thumb.jpeg"" /></a><br /><br />Мало кто знает, какой неожиданный эффект может быть, если разогреть бутылку колы газовой горелкой. Это правда, я проверил"
7b9e8da3d4890e3f197abd0fe90de091,[Photo],https://t.me/nn4st/246408,t.me,2025-08-08T16:44:05+00:00,"<a href=""https://tg.i-c-a.su/media/nn4st/246408/5237996764374627583_x_2.jpg"" rel=""nofollow"" target=""_blank""><img src=""https://tg.i-c-a.su/media/nn4st/246408/preview/thumb.jpeg"" /></a><br /><br />"
cd277a3bec39aa7a27ff7fd053005796,"[Photo] Вот прям подходящая новость к вечеру пятницы 😂😂😂Говорят, искусственный интеллект бе [...]",https://t.me/directorsoyuz/1878,t.me,2025-08-08T15:38:56+00:00,"<a href=""https://tg.i-c-a.su/media/directorsoyuz/1878/5237876878952495638_w_2.jpg"" rel=""nofollow"" target=""_blank""><img src=""https://tg.i-c-a.su/media/directorsoyuz/1878/preview/thumb.jpeg"" /></a><br /><br />Вот прям подходящая новость к вечеру пятницы 😂😂😂<br /><br />Говорят, искусственный интеллект безэмоционален, сухой и вообще не имеет характера. Это потому что вы не видели, как Gemini дебажит собственный код.<br /><br />Чел <a href=""https://www.reddit.com/r/GeminiAI/comments/1lxqbxa/i_am_actu…"
647bf783b71045b3d22a3a749e7ecf50,[Photo] Давно Сара не появлялась на моих просторах.,https://t.me/neyr0graph/3104,t.me,2025-08-08T15:44:11+00:00,"<a href=""https://tg.i-c-a.su/media/neyr0graph/3104/5240481424430199461_y_2.jpg"" rel=""nofollow"" target=""_blank""><img src=""https://tg.i-c-a.su/media/neyr0graph/3104/preview/thumb.jpeg"" /></a><br /><a href=""https://tg.i-c-a.su/media/neyr0graph/3105/5240481424430199462_y_2.jpg"" rel=""nofollow"" target=""_blank""><img src=""https://tg.i-c-a.su/media/neyr0graph/3105/preview/thumb.jpeg"" /></a><br /><a href=""https://tg.i-c-a.su/media/neyr0graph/3106/5240481424430199463_y_2.jpg"" rel=""nofollow"" target=""_blank""…"
9e924fb5e5c635be66b4b883963ade3e,"Нет доверия субмитеру, то галочку не поставил что ии то ещё какая фигня.",https://t.me/fotostoki_ru_chat/32645,t.me,2025-08-08T16:00:54+00:00,"<br />Нет доверия субмитеру, то галочку не поставил что ии то ещё какая фигня. Если свои фото грузить то да, нет вопросов."
cdb6c6f6d0410ce516361eaf70eee7c2,По разному.,https://t.me/fotostoki_ru_chat/32644,t.me,2025-08-08T15:50:10+00:00,<br />По разному. За эту неделю штук 700-900 точно. Позавчера активная приемка была 4 батча залил...
87c9dc4ace0f07d29626da633e3f6a4c,"<br />А в цифрах ,скажем в день",https://t.me/fotostoki_ru_chat/32643,t.me,2025-08-08T15:47:28+00:00,"<br />А в цифрах ,скажем в день"
9fb954f22ee6a99f9e07630133566c58,"Я лимитов пока не обнаружил, хотя гружу активно и иногда много",https://t.me/fotostoki_ru_chat/32642,t.me,2025-08-08T15:47:03+00:00,"<br />Я лимитов пока не обнаружил, хотя гружу активно и иногда много"
5c14e1d630edcbc43b1787893a6c5a41,Сабмитер позволят грузить по расписанию...,https://t.me/fotostoki_ru_chat/32641,t.me,2025-08-08T15:45:44+00:00,"<br />Сабмитер позволят грузить по расписанию... это который м. Сам им не пользуюсь, но инфа 100ка"
bf57469db9979f3a17e38ab48ccb568d,Спасибо.,https://t.me/StockSubmitter/154524,t.me,2025-08-08T18:33:52+00:00,"<br />Спасибо. Значит, только загружать можно, а сабмитить уже на шаттере..."
9c57f4ee4124ee0cad57c3278a641bb6,<br />Пока нет,https://t.me/StockSubmitter/154523,t.me,2025-08-08T18:32:57+00:00,<br />Пока нет
292fc0a847a197e5820905facbdb006a,"Не подскажите, появилась возможность номер, выданный после предоставления аккредитации, куда-т [...]",https://t.me/StockSubmitter/154522,t.me,2025-08-08T18:31:24+00:00,"<br />Не подскажите, появилась возможность номер, выданный после предоставления аккредитации, куда-то поставить?"
a327d9a7688b0d6ddb006e793a8a5998,[Media],https://t.me/neyr0graph/3110,t.me,2025-08-08T18:04:29+00:00,"<a href=""https://tg.i-c-a.su/media/neyr0graph/3110/Trap+%2B+%D0%B0%D0%BA%D1%83%D1%81%D1%82%D0%B8%D1%87%D0%B5%D1%81%D0%BA%D0%B0%D1%8F+%D0%B3%D0%B8%D1%82%D0%B0%D1%80%D0%B0_5240481423973971837.wav"" rel=""nofollow"" target=""_blank""><img src=""https://tg.i-c-a.su/media/neyr0graph/3110/preview/thumb.jpeg"" /></a><br /><a href=""https://tg.i-c-a.su/media/neyr0graph/3111/Trap+%2B+%D1%81%D0%B0%D0%BA%D1%81%D0%BE%D1%84%D0%BE%D0%BD_5240481423973971838.wav"" rel=""nofollow"" target=""_blank""><img src=""https://tg.i-c-…"
